03/29/18 23.13.58.393 Open file
                      Open "C:\Users\rafal\Documents\GitHub\Model_Ogolny_Miejskiej_Mobilnosci\MOMM\Scenarios\S000006\Protocol.txt"
                      Open "C:\Users\rafal\Documents\GitHub\Model_Ogolny_Miejskiej_Mobilnosci\MOMM\Scenarios\S000006\Messages.txt"
                      Starting to process computation order for scenario 6
                      Delete network
03/29/18 23.13.58.644 Start time of Read version C:\Users\rafal\Documents\GitHub\Model_Ogolny_Miejskiej_Mobilnosci\MOMM\MOMMBase.ver
                            19 User-defined attributes
                             8 Transport systems
                             5 Modes
                             5 Demand segments
                             1 Calendar periods
                             1 Valid days
                             2 Directions
                           749 Points
                           749 Edges
                            28 Faces
                            28 Surfaces
                           487 Nodes
                            28 Zones
                             1 Territories
                           100 Link types
                          1448 Links
                          4496 Turns
                           184 Connectors
                            45 Lines
                             1 Block versions
                             1 Signal coordination groups
                             3 Signalized junctions
                             1 Demand models
                             9 Demand strata
                            37 Matrices
                             1 Time series
                             1 Demand time series
                             1 Path sets
                             1 Turning standards
03/29/18 23.13.59.144 End time of Read version C:\Users\rafal\Documents\GitHub\Model_Ogolny_Miejskiej_Mobilnosci\MOMM\MOMMBase.ver
03/29/18 23.13.59.624 Procedure parameters read from file "C:\Users\rafal\Documents\GitHub\Model_Ogolny_Miejskiej_Mobilnosci\MOMM\Procedures\P000002.xml".
03/29/18 23.13.59.699 Procedure parameters read from file "C:\Users\rafal\Documents\GitHub\Model_Ogolny_Miejskiej_Mobilnosci\MOMM\Procedures\P000002.xml".
03/29/18 23.13.59.842 Procedure - start
03/29/18 23.13.59.975 Start Procedure step   1: "Group"
03/29/18 23.14.00.290 Start Procedure step   2: "Calculate PrT skim matrix"
                      The shortest path graph has been reduced by 74.4%
03/29/18 23.14.00.611 Start Procedure step   3: "Calculate PuT skim matrix"
                      The assignment was successfully completed.
03/29/18 23.14.00.994 Start Procedure step   4: "Group"
03/29/18 23.14.01.137 Start Procedure step   5: "Trip generation"
                      Vorbereitung Verkehrserzeugung
                      Verkehrserzeugung Start
                      Totals for demand layer 01 D-P before standardization (option 1): Productions: 28676.000 Attractions: 29020.000
                      Totals for demand layer 02 P-D before standardization (option 2): Productions: 29020.000 Attractions: 25091.500
                      Totals for demand layer 03 D-N before standardization (option 1): Productions: 7169.000 Attractions: 5758.000
                      Totals for demand layer 04 N-D before standardization (option 2): Productions: 5758.000 Attractions: 7169.000
                      Totals for demand layer 05 D-U before standardization (option 1): Productions: 3584.500 Attractions: 2661.000
                      Totals for demand layer 06 U-D before standardization (option 2): Productions: 2661.000 Attractions: 3584.500
                      Totals for demand layer 07 D-I before standardization (option 1): Productions: 14338.000 Attractions: 17767.000
                      Totals for demand layer 08 I-D before standardization (option 2): Productions: 17767.000 Attractions: 17922.500
                      Totals for demand layer 09 NZD before standardization (option 1): Productions: 26650.500 Attractions: 26650.500
                      Verkehrserzeugung Ende
03/29/18 23.14.01.336 Start Procedure step   6: "Trip distribution"
                      Matrix total 101  after distribution of all demand strata: 28676.000
                      Matrix total 102  after distribution of all demand strata: 25091.500
                      Matrix total 103  after distribution of all demand strata: 7169.000
                      Matrix total 104  after distribution of all demand strata: 7169.000
                      Matrix total 105  after distribution of all demand strata: 3584.500
                      Matrix total 106  after distribution of all demand strata: 3584.500
                      Matrix total 107  after distribution of all demand strata: 14338.000
                      Matrix total 108  after distribution of all demand strata: 17922.500
                      Matrix total 109  after distribution of all demand strata: 26650.500
                      Matrix total 101  after distribution of all demand strata: 28676.000
Matrix total 102  after distribution of all demand strata: 25091.500
Matrix total 103  after distribution of all demand strata: 7169.000
Matrix total 104  after distribution of all demand strata: 7169.000
Matrix total 105  after distribution of all demand strata: 3584.500
Matrix total 106  after distribution of all demand strata: 3584.500
Matrix total 107  after distribution of all demand strata: 14338.000
Matrix total 108  after distribution of all demand strata: 17922.500
Matrix total 109  after distribution of all demand strata: 26650.500
03/29/18 23.14.01.543 Start Procedure step   7: "Mode choice"
                      Sum matrix 201  after Mode choice of Demand stratum 01 D-P: 15054.303
                      Sum matrix 202  after Mode choice of Demand stratum 01 D-P: 13621.697
                      Sum matrix 203  after Mode choice of Demand stratum 02 P-D: 13172.515
                      Sum matrix 204  after Mode choice of Demand stratum 02 P-D: 11918.985
                      Sum matrix 205  after Mode choice of Demand stratum 03 D-N: 2540.290
                      Sum matrix 206  after Mode choice of Demand stratum 03 D-N: 4628.710
                      Sum matrix 207  after Mode choice of Demand stratum 04 N-D: 2540.290
                      Sum matrix 208  after Mode choice of Demand stratum 04 N-D: 4628.710
                      Sum matrix 209  after Mode choice of Demand stratum 05 D-U: 1438.504
                      Sum matrix 210  after Mode choice of Demand stratum 05 D-U: 2145.996
                      Sum matrix 211  after Mode choice of Demand stratum 06 U-D: 1438.504
                      Sum matrix 212  after Mode choice of Demand stratum 06 U-D: 2145.996
                      Sum matrix 213  after Mode choice of Demand stratum 07 D-I: 8583.984
                      Sum matrix 214  after Mode choice of Demand stratum 07 D-I: 5754.016
                      Sum matrix 215  after Mode choice of Demand stratum 08 I-D: 10729.980
                      Sum matrix 216  after Mode choice of Demand stratum 08 I-D: 7192.520
                      Sum matrix 217  after Mode choice of Demand stratum 09 NZD: 14653.351
                      Sum matrix 218  after Mode choice of Demand stratum 09 NZD: 11997.149
                      Successfully calculated mode choice for 9 demand strata and 2 modes. Global modal split:  PuT: 52.28% SO: 52.28%
03/29/18 23.14.01.780 Start Procedure step   8: "Mode choice"
                      Sum matrix 201  after Mode choice of Demand stratum 01 D-P: 11795.633
                      Sum matrix 202  after Mode choice of Demand stratum 01 D-P: 16880.367
                      Sum matrix 203  after Mode choice of Demand stratum 02 P-D: 10316.194
                      Sum matrix 204  after Mode choice of Demand stratum 02 P-D: 14775.306
                      Sum matrix 205  after Mode choice of Demand stratum 03 D-N: 2916.789
                      Sum matrix 206  after Mode choice of Demand stratum 03 D-N: 4252.211
                      Sum matrix 207  after Mode choice of Demand stratum 04 N-D: 2916.676
                      Sum matrix 208  after Mode choice of Demand stratum 04 N-D: 4252.324
                      Sum matrix 209  after Mode choice of Demand stratum 05 D-U: 1468.510
                      Sum matrix 210  after Mode choice of Demand stratum 05 D-U: 2115.990
                      Sum matrix 211  after Mode choice of Demand stratum 06 U-D: 1468.764
                      Sum matrix 212  after Mode choice of Demand stratum 06 U-D: 2115.736
                      Sum matrix 213  after Mode choice of Demand stratum 07 D-I: 5828.995
                      Sum matrix 214  after Mode choice of Demand stratum 07 D-I: 8509.005
                      Sum matrix 215  after Mode choice of Demand stratum 08 I-D: 7285.822
                      Sum matrix 216  after Mode choice of Demand stratum 08 I-D: 10636.678
                      Sum matrix 217  after Mode choice of Demand stratum 09 NZD: 11038.924
                      Sum matrix 218  after Mode choice of Demand stratum 09 NZD: 15611.576
                      Successfully calculated mode choice for 9 demand strata and 2 modes. Global modal split:  PuT: 41.02% SO: 41.02%
03/29/18 23.14.02.019 Start Procedure step  10: "Combination of matrices and vectors"
03/29/18 23.14.02.162 Start Procedure step  11: "Combination of matrices and vectors"
03/29/18 23.14.02.300 Start Procedure step  12: "Combination of matrices and vectors"
03/29/18 23.14.02.432 Start Procedure step  13: "Combination of matrices and vectors"
03/29/18 23.14.02.581 Start Procedure step  14: "Group"
03/29/18 23.14.02.714 Start Procedure step  15: "Combination of matrices and vectors"
03/29/18 23.14.02.849 Start Procedure step  16: "Combination of matrices and vectors"
03/29/18 23.14.02.986 Start Procedure step  17: "Combination of matrices and vectors"
03/29/18 23.14.03.131 Start Procedure step  18: "Group"
03/29/18 23.14.03.285 Start Procedure step  19: "PrT assignment"
                      Start of ICA calculation
                      End of ICA calculation
                      The shortest path graph has been reduced by 74.4%
                      Iteration 1, DSeg SO, routes in total 552
                      Start of ICA calculation
                      End of ICA calculation
                      Start of ICA calculation
                      End of ICA calculation
                      Start of ICA calculation
                      End of ICA calculation
                      Start of ICA calculation
                      End of ICA calculation
                      The shortest path graph has been reduced by 74.4%
                      Iteration 2 DSeg Samochód osobowy routes total 860 routes new 308
                      Start of ICA calculation
                      End of ICA calculation
                      Iteration     2 network balancing step     1 modified OD pairs   306 total excess cost 10150441.03801956 avg excess cost 1822.25893725
                      Iteration     2 network balancing step     2 modified OD pairs    29 total excess cost 838936.76262283 avg excess cost 150.61020578
                      Iteration     2 network balancing step     3 modified OD pairs    12 total excess cost 17657.24477478 avg excess cost 3.16991862
                      Iteration     2 network balancing step     4 modified OD pairs     8 total excess cost 2302.35672922 avg excess cost 0.41333082
                      Iteration     2 network balancing step     5 modified OD pairs     3 total excess cost 112.99863683 avg excess cost 0.02028609
                      Iteration     2 number of deleted paths after OD balancing 294
                      Iteration     2 number of deleted paths after network balancing 1
                      
                      Iteration     2 gap 0.15492955
                      
                      Start of ICA calculation
                      End of ICA calculation
                      The shortest path graph has been reduced by 74.4%
                      Iteration 3 DSeg Samochód osobowy routes total 766 routes new 201
                      Start of ICA calculation
                      End of ICA calculation
                      Iteration     3 network balancing step     1 modified OD pairs   192 total excess cost 1664047.10807396 avg excess cost 298.73822264
                      Iteration     3 network balancing step     2 modified OD pairs    34 total excess cost 185222.13404113 avg excess cost 33.25202204
                      Iteration     3 network balancing step     3 modified OD pairs    16 total excess cost 45022.96507618 avg excess cost 8.08275228
                      Iteration     3 network balancing step     4 modified OD pairs    13 total excess cost 27613.04544673 avg excess cost 4.95723473
                      Iteration     3 network balancing step     5 modified OD pairs    10 total excess cost 13373.11384030 avg excess cost 2.40080959
                      Iteration     3 number of deleted paths after OD balancing 186
                      Iteration     3 number of deleted paths after network balancing 7
                      
                      Iteration     3 gap 0.01637735
                      
                      Start of ICA calculation
                      End of ICA calculation
                      The shortest path graph has been reduced by 74.4%
                      Iteration 4 DSeg Samochód osobowy routes total 680 routes new 107
                      Start of ICA calculation
                      End of ICA calculation
                      Iteration     4 network balancing step     1 modified OD pairs    94 total excess cost 329167.77462632 avg excess cost 59.09387749
                      Iteration     4 network balancing step     2 modified OD pairs    41 total excess cost 82052.13540699 avg excess cost 14.73041777
                      Iteration     4 network balancing step     3 modified OD pairs    22 total excess cost 13976.70093234 avg excess cost 2.50916863
                      Iteration     4 network balancing step     4 modified OD pairs    18 total excess cost 7578.91558902 avg excess cost 1.36060558
                      Iteration     4 network balancing step     5 modified OD pairs    15 total excess cost 5010.04947282 avg excess cost 0.89942963
                      Iteration     4 number of deleted paths after OD balancing 78
                      Iteration     4 number of deleted paths after network balancing 15
                      
                      Iteration     4 gap 0.00446582
                      
                      Start of ICA calculation
                      End of ICA calculation
                      The shortest path graph has been reduced by 74.4%
                      Iteration 5 DSeg Samochód osobowy routes total 674 routes new 87
                      Start of ICA calculation
                      End of ICA calculation
                      Iteration     5 network balancing step     1 modified OD pairs    53 total excess cost 266580.72110715 avg excess cost 47.85793048
                      Iteration     5 network balancing step     2 modified OD pairs    37 total excess cost 95810.38678986 avg excess cost 17.20036922
                      Iteration     5 network balancing step     3 modified OD pairs    23 total excess cost 22324.59604502 avg excess cost 4.00782533
                      Iteration     5 network balancing step     4 modified OD pairs    19 total excess cost 4023.60346667 avg excess cost 0.72233781
                      Iteration     5 network balancing step     5 modified OD pairs    17 total excess cost 2351.81067181 avg excess cost 0.42220904
                      Iteration     5 number of deleted paths after OD balancing 33
                      Iteration     5 number of deleted paths after network balancing 40
                      
                      Iteration     5 gap 0.00174975
                      
                      Start of ICA calculation
                      End of ICA calculation
                      The shortest path graph has been reduced by 74.4%
                      Iteration 6 DSeg Samochód osobowy routes total 643 routes new 42
                      Start of ICA calculation
                      End of ICA calculation
                      Iteration     6 network balancing step     1 modified OD pairs    41 total excess cost 30270.07018369 avg excess cost 5.43423736
                      Iteration     6 network balancing step     2 modified OD pairs    22 total excess cost 2588.57620708 avg excess cost 0.46471440
                      Iteration     6 network balancing step     3 modified OD pairs    15 total excess cost 731.01827966 avg excess cost 0.13123613
                      Iteration     6 network balancing step     4 modified OD pairs     9 total excess cost 353.81147918 avg excess cost 0.06351804
                      Iteration     6 network balancing step     5 modified OD pairs     5 total excess cost 284.36331603 avg excess cost 0.05105035
                      Iteration     6 number of deleted paths after OD balancing 20
                      Iteration     6 number of deleted paths after network balancing 20
                      
                      Iteration     6 gap 0.00041539
                      
                      Start of ICA calculation
                      End of ICA calculation
                      The shortest path graph has been reduced by 74.4%
                      Iteration 7 DSeg Samochód osobowy routes total 613 routes new 10
                      Start of ICA calculation
                      End of ICA calculation
                      Iteration     7 network balancing step     1 modified OD pairs     6 total excess cost 200.71174306 avg excess cost 0.03603280
                      Iteration     7 network balancing step     2 modified OD pairs     5 total excess cost 187.27704315 avg excess cost 0.03362093
                      Iteration     7 network balancing step     3 modified OD pairs    10 total excess cost 156.76813517 avg excess cost 0.02814382
                      Iteration     7 network balancing step     4 modified OD pairs     8 total excess cost 207.98438466 avg excess cost 0.03733842
                      Iteration     7 network balancing step     5 modified OD pairs     7 total excess cost 186.25695233 avg excess cost 0.03343780
                      Iteration     7 number of deleted paths after OD balancing 7
                      Iteration     7 number of deleted paths after network balancing 2
                      
                      Iteration     7 gap 0.00000280
                      
                      Equilibrium assignment finished after 7 iteration steps
03/29/18 23.14.03.923 Time before  WBRePack
03/29/18 23.14.03.924 Time after WBRePack
                      Start of ICA calculation
                      End of ICA calculation
                      The assignment reached convergence after 7 of a maximum of 20 iterations with a GAP of 2.80020609e-06.
03/29/18 23.14.04.145 Start Procedure step  20: "PuT assignment"
                      Assignment with 4 core(s)
03/29/18 23.14.04.266 Assignment after Init
                      Search from zone 8: Search tree dimension = 3, time = 0s
                      No path found on relation 8 -> 2. Non-assigned demand for DSeg PuT: 49.8
                      No path found on relation 8 -> 3. Non-assigned demand for DSeg PuT: 51.247
                      No path found on relation 8 -> 4. Non-assigned demand for DSeg PuT: 3.53
                      No path found on relation 8 -> 5. Non-assigned demand for DSeg PuT: 5.351
                      No path found on relation 8 -> 6. Non-assigned demand for DSeg PuT: 84.591
                      No path found on relation 8 -> 7. Non-assigned demand for DSeg PuT: 22.206
                      No path found on relation 8 -> 9. Non-assigned demand for DSeg PuT: 9.298
                      No path found on relation 8 -> 10. Non-assigned demand for DSeg PuT: 30.856
                      No path found on relation 8 -> 11. Non-assigned demand for DSeg PuT: 38.272
                      No path found on relation 8 -> 12. Non-assigned demand for DSeg PuT: 13.906
                      No path found on relation 8 -> 13. Non-assigned demand for DSeg PuT: 18.548
                      No path found on relation 8 -> 14. Non-assigned demand for DSeg PuT: 5.549
                      No path found on relation 8 -> 16. Non-assigned demand for DSeg PuT: 0.276
                      No path found on relation 8 -> 17. Non-assigned demand for DSeg PuT: 32.025
                      No path found on relation 8 -> 18. Non-assigned demand for DSeg PuT: 7.123
                      No path found on relation 8 -> 19. Non-assigned demand for DSeg PuT: 59.585
                      No path found on relation 8 -> 20. Non-assigned demand for DSeg PuT: 2.716
                      No path found on relation 8 -> 22. Non-assigned demand for DSeg PuT: 136.89
                      No path found on relation 8 -> 23. Non-assigned demand for DSeg PuT: 224.241
                      No path found on relation 8 -> 24. Non-assigned demand for DSeg PuT: 350.918
                      Search from zone 1: Search tree dimension = 3905, time = 0s
                      No path found on relation 1 -> 5. Non-assigned demand for DSeg PuT: 2.695
                      No path found on relation 1 -> 7. Non-assigned demand for DSeg PuT: 1.86
                      Search from zone 9: Search tree dimension = 5114, time = 0s
                      Search from zone 4: Search tree dimension = 4893, time = 0s
                      No path found on relation 1 -> 18. Non-assigned demand for DSeg PuT: 1.006
                      No path found on relation 1 -> 20. Non-assigned demand for DSeg PuT: 0.571
                      No path found on relation 4 -> 5. Non-assigned demand for DSeg PuT: 6.58
                      No path found on relation 4 -> 7. Non-assigned demand for DSeg PuT: 1.046
                      No path found on relation 4 -> 8. Non-assigned demand for DSeg PuT: 3.164
                      No path found on relation 4 -> 20. Non-assigned demand for DSeg PuT: 0.067
                      No path found on relation 4 -> 21. Non-assigned demand for DSeg PuT: 2.342
                      Search from zone 5: Search tree dimension = 3, time = 0s
                      No path found on relation 5 -> 1. Non-assigned demand for DSeg PuT: 1.788
                      No path found on relation 5 -> 4. Non-assigned demand for DSeg PuT: 6.916
                      No path found on relation 5 -> 6. Non-assigned demand for DSeg PuT: 41.358
                      No path found on relation 5 -> 7. Non-assigned demand for DSeg PuT: 2.23
                      No path found on relation 5 -> 8. Non-assigned demand for DSeg PuT: 4.352
                      No path found on relation 5 -> 9. Non-assigned demand for DSeg PuT: 1.438
                      No path found on relation 5 -> 10. Non-assigned demand for DSeg PuT: 23.964
                      No path found on relation 5 -> 11. Non-assigned demand for DSeg PuT: 7.419
                      No path found on relation 5 -> 12. Non-assigned demand for DSeg PuT: 22.816
                      No path found on relation 5 -> 13. Non-assigned demand for DSeg PuT: 37.465
                      No path found on relation 5 -> 14. Non-assigned demand for DSeg PuT: 45.825
                      No path found on relation 5 -> 15. Non-assigned demand for DSeg PuT: 7.202
                      No path found on relation 5 -> 16. Non-assigned demand for DSeg PuT: 0.174
                      No path found on relation 5 -> 17. Non-assigned demand for DSeg PuT: 111.088
                      No path found on relation 5 -> 19. Non-assigned demand for DSeg PuT: 16.006
                      No path found on relation 5 -> 20. Non-assigned demand for DSeg PuT: 0.397
                      No path found on relation 5 -> 21. Non-assigned demand for DSeg PuT: 23.439
                      No path found on relation 5 -> 22. Non-assigned demand for DSeg PuT: 62.868
                      No path found on relation 5 -> 23. Non-assigned demand for DSeg PuT: 344.404
                      No path found on relation 5 -> 24. Non-assigned demand for DSeg PuT: 359.064
                      Search from zone 2: Search tree dimension = 4362, time = 0s
                      No path found on relation 2 -> 7. Non-assigned demand for DSeg PuT: 5.049
                      No path found on relation 2 -> 8. Non-assigned demand for DSeg PuT: 19.668
                      Search from zone 15: Search tree dimension = 4630, time = 0s
                      No path found on relation 15 -> 5. Non-assigned demand for DSeg PuT: 9.927
                      No path found on relation 2 -> 20. Non-assigned demand for DSeg PuT: 1.117
                      No path found on relation 2 -> 21. Non-assigned demand for DSeg PuT: 84.597
                      No path found on relation 15 -> 18. Non-assigned demand for DSeg PuT: 6.068
                      No path found on relation 15 -> 20. Non-assigned demand for DSeg PuT: 3.141
                      Search from zone 6: Search tree dimension = 5980, time = 0s
                      No path found on relation 6 -> 5. Non-assigned demand for DSeg PuT: 42.211
                      No path found on relation 6 -> 7. Non-assigned demand for DSeg PuT: 18.638
                      No path found on relation 6 -> 8. Non-assigned demand for DSeg PuT: 81.667
                      Search from zone 3: Search tree dimension = 4750, time = 0s
                      No path found on relation 3 -> 7. Non-assigned demand for DSeg PuT: 12.353
                      No path found on relation 6 -> 18. Non-assigned demand for DSeg PuT: 26.295
                      No path found on relation 3 -> 8. Non-assigned demand for DSeg PuT: 48.042
                      No path found on relation 6 -> 20. Non-assigned demand for DSeg PuT: 1.432
                      No path found on relation 6 -> 21. Non-assigned demand for DSeg PuT: 120.383
                      Search from zone 7: Search tree dimension = 1, time = 0s
                      No path found on relation 7 -> 1. Non-assigned demand for DSeg PuT: 1.919
                      No path found on relation 7 -> 2. Non-assigned demand for DSeg PuT: 12.598
                      No path found on relation 7 -> 3. Non-assigned demand for DSeg PuT: 12.59
                      No path found on relation 7 -> 4. Non-assigned demand for DSeg PuT: 1.137
                      No path found on relation 7 -> 5. Non-assigned demand for DSeg PuT: 3.046
                      No path found on relation 7 -> 6. Non-assigned demand for DSeg PuT: 18.836
                      No path found on relation 7 -> 8. Non-assigned demand for DSeg PuT: 21.9
                      No path found on relation 7 -> 9. Non-assigned demand for DSeg PuT: 1.975
                      No path found on relation 7 -> 10. Non-assigned demand for DSeg PuT: 15.831
                      No path found on relation 7 -> 11. Non-assigned demand for DSeg PuT: 5.772
                      No path found on relation 7 -> 12. Non-assigned demand for DSeg PuT: 2.917
                      No path found on relation 7 -> 13. Non-assigned demand for DSeg PuT: 3.593
                      No path found on relation 7 -> 14. Non-assigned demand for DSeg PuT: 2.44
                      No path found on relation 7 -> 16. Non-assigned demand for DSeg PuT: 0.127
                      No path found on relation 7 -> 17. Non-assigned demand for DSeg PuT: 10.132
                      No path found on relation 7 -> 18. Non-assigned demand for DSeg PuT: 1.562
                      No path found on relation 7 -> 19. Non-assigned demand for DSeg PuT: 21.739
                      No path found on relation 7 -> 20. Non-assigned demand for DSeg PuT: 0.351
                      No path found on relation 3 -> 20. Non-assigned demand for DSeg PuT: 3.241
                      No path found on relation 3 -> 21. Non-assigned demand for DSeg PuT: 85.047
                      No path found on relation 7 -> 21. Non-assigned demand for DSeg PuT: 31.318
                      No path found on relation 7 -> 22. Non-assigned demand for DSeg PuT: 18.133
                      No path found on relation 7 -> 23. Non-assigned demand for DSeg PuT: 86.837
                      No path found on relation 7 -> 24. Non-assigned demand for DSeg PuT: 102.378
                      Search from zone 18: Search tree dimension = 4, time = 0s
                      No path found on relation 18 -> 1. Non-assigned demand for DSeg PuT: 0.861
                      No path found on relation 18 -> 6. Non-assigned demand for DSeg PuT: 25.846
                      No path found on relation 18 -> 7. Non-assigned demand for DSeg PuT: 1.586
                      No path found on relation 18 -> 8. Non-assigned demand for DSeg PuT: 6.511
                      No path found on relation 18 -> 9. Non-assigned demand for DSeg PuT: 0.988
                      No path found on relation 18 -> 10. Non-assigned demand for DSeg PuT: 19.744
                      No path found on relation 18 -> 11. Non-assigned demand for DSeg PuT: 7.057
                      No path found on relation 18 -> 12. Non-assigned demand for DSeg PuT: 3.967
                      No path found on relation 18 -> 13. Non-assigned demand for DSeg PuT: 5.71
                      No path found on relation 18 -> 14. Non-assigned demand for DSeg PuT: 13.239
                      No path found on relation 18 -> 15. Non-assigned demand for DSeg PuT: 5.786
                      No path found on relation 18 -> 16. Non-assigned demand for DSeg PuT: 0.167
                      No path found on relation 18 -> 17. Non-assigned demand for DSeg PuT: 24.777
                      No path found on relation 18 -> 19. Non-assigned demand for DSeg PuT: 30.442
                      No path found on relation 18 -> 20. Non-assigned demand for DSeg PuT: 0.453
                      No path found on relation 18 -> 21. Non-assigned demand for DSeg PuT: 18.993
                      No path found on relation 18 -> 22. Non-assigned demand for DSeg PuT: 27.782
                      No path found on relation 18 -> 23. Non-assigned demand for DSeg PuT: 249.467
                      No path found on relation 18 -> 24. Non-assigned demand for DSeg PuT: 125.228
                      Search from zone 16: Search tree dimension = 5856, time = 0s
                      No path found on relation 16 -> 5. Non-assigned demand for DSeg PuT: 0.157
                      No path found on relation 16 -> 7. Non-assigned demand for DSeg PuT: 0.118
                      No path found on relation 16 -> 8. Non-assigned demand for DSeg PuT: 0.242
                      No path found on relation 16 -> 18. Non-assigned demand for DSeg PuT: 0.163
                      No path found on relation 16 -> 20. Non-assigned demand for DSeg PuT: 0.007
                      No path found on relation 16 -> 21. Non-assigned demand for DSeg PuT: 0.143
                      Search from zone 19: Search tree dimension = 7569, time = 0s
                      No path found on relation 19 -> 5. Non-assigned demand for DSeg PuT: 14.939
                      No path found on relation 19 -> 7. Non-assigned demand for DSeg PuT: 19.963
                      No path found on relation 19 -> 8. Non-assigned demand for DSeg PuT: 52.263
                      Search from zone 22: Search tree dimension = 5451, time = 0s
                      No path found on relation 22 -> 5. Non-assigned demand for DSeg PuT: 64.472
                      No path found on relation 22 -> 7. Non-assigned demand for DSeg PuT: 17.292
                      No path found on relation 22 -> 8. Non-assigned demand for DSeg PuT: 130.761
                      No path found on relation 19 -> 18. Non-assigned demand for DSeg PuT: 29.397
                      No path found on relation 19 -> 20. Non-assigned demand for DSeg PuT: 0.663
                      No path found on relation 19 -> 21. Non-assigned demand for DSeg PuT: 40.036
                      Search from zone 17: Search tree dimension = 5509, time = 0s
                      No path found on relation 22 -> 18. Non-assigned demand for DSeg PuT: 27.448
                      No path found on relation 22 -> 20. Non-assigned demand for DSeg PuT: 2.594
                      Search from zone 20: Search tree dimension = 1, time = 0s
                      No path found on relation 20 -> 1. Non-assigned demand for DSeg PuT: 0.496
                      No path found on relation 20 -> 2. Non-assigned demand for DSeg PuT: 1.084
                      No path found on relation 20 -> 3. Non-assigned demand for DSeg PuT: 3.088
                      No path found on relation 20 -> 4. Non-assigned demand for DSeg PuT: 0.116
                      No path found on relation 20 -> 5. Non-assigned demand for DSeg PuT: 0.371
                      No path found on relation 20 -> 6. Non-assigned demand for DSeg PuT: 1.413
                      No path found on relation 20 -> 7. Non-assigned demand for DSeg PuT: 0.343
                      No path found on relation 20 -> 8. Non-assigned demand for DSeg PuT: 2.391
                      No path found on relation 20 -> 9. Non-assigned demand for DSeg PuT: 3.483
                      No path found on relation 20 -> 10. Non-assigned demand for DSeg PuT: 8.579
                      No path found on relation 20 -> 12. Non-assigned demand for DSeg PuT: 5.195
                      No path found on relation 17 -> 5. Non-assigned demand for DSeg PuT: 101.826
                      No path found on relation 20 -> 13. Non-assigned demand for DSeg PuT: 9.044
                      No path found on relation 20 -> 14. Non-assigned demand for DSeg PuT: 1.868
                      No path found on relation 20 -> 15. Non-assigned demand for DSeg PuT: 2.868
                      No path found on relation 20 -> 16. Non-assigned demand for DSeg PuT: 0.007
                      No path found on relation 20 -> 17. Non-assigned demand for DSeg PuT: 5.506
                      No path found on relation 20 -> 18. Non-assigned demand for DSeg PuT: 0.445
                      No path found on relation 20 -> 19. Non-assigned demand for DSeg PuT: 0.649
                      No path found on relation 20 -> 21. Non-assigned demand for DSeg PuT: 6.474
                      No path found on relation 20 -> 22. Non-assigned demand for DSeg PuT: 2.569
                      No path found on relation 20 -> 23. Non-assigned demand for DSeg PuT: 36.123
                      No path found on relation 20 -> 24. Non-assigned demand for DSeg PuT: 19.566
                      No path found on relation 17 -> 7. Non-assigned demand for DSeg PuT: 9.24
                      No path found on relation 17 -> 8. Non-assigned demand for DSeg PuT: 27.699
                      Search from zone 21: Search tree dimension = 4, time = 0s
                      No path found on relation 21 -> 2. Non-assigned demand for DSeg PuT: 77.164
                      No path found on relation 21 -> 3. Non-assigned demand for DSeg PuT: 61.138
                      No path found on relation 21 -> 4. Non-assigned demand for DSeg PuT: 2.104
                      No path found on relation 21 -> 5. Non-assigned demand for DSeg PuT: 25.093
                      No path found on relation 21 -> 6. Non-assigned demand for DSeg PuT: 126.572
                      No path found on relation 21 -> 7. Non-assigned demand for DSeg PuT: 32.078
                      No path found on relation 21 -> 10. Non-assigned demand for DSeg PuT: 41.828
                      No path found on relation 21 -> 11. Non-assigned demand for DSeg PuT: 85.931
                      No path found on relation 21 -> 12. Non-assigned demand for DSeg PuT: 51.755
                      No path found on relation 21 -> 13. Non-assigned demand for DSeg PuT: 71.218
                      No path found on relation 21 -> 14. Non-assigned demand for DSeg PuT: 12.26
                      No path found on relation 21 -> 16. Non-assigned demand for DSeg PuT: 0.157
                      No path found on relation 21 -> 17. Non-assigned demand for DSeg PuT: 85.969
                      No path found on relation 21 -> 18. Non-assigned demand for DSeg PuT: 13.893
                      No path found on relation 21 -> 19. Non-assigned demand for DSeg PuT: 43.695
                      No path found on relation 21 -> 20. Non-assigned demand for DSeg PuT: 7.197
                      No path found on relation 21 -> 22. Non-assigned demand for DSeg PuT: 196.756
                      No path found on relation 21 -> 23. Non-assigned demand for DSeg PuT: 372.001
                      No path found on relation 21 -> 24. Non-assigned demand for DSeg PuT: 335.497
                      No path found on relation 22 -> 21. Non-assigned demand for DSeg PuT: 184.864
                      No path found on relation 17 -> 18. Non-assigned demand for DSeg PuT: 22.936
                      No path found on relation 17 -> 20. Non-assigned demand for DSeg PuT: 5.386
                      No path found on relation 17 -> 21. Non-assigned demand for DSeg PuT: 77.347
                      No path found on relation 9 -> 5. Non-assigned demand for DSeg PuT: 1.373
                      No path found on relation 9 -> 7. Non-assigned demand for DSeg PuT: 1.948
                      No path found on relation 9 -> 8. Non-assigned demand for DSeg PuT: 8.789
                      No path found on relation 9 -> 18. Non-assigned demand for DSeg PuT: 0.546
                      No path found on relation 9 -> 20. Non-assigned demand for DSeg PuT: 3.78
                      Search from zone 11: Search tree dimension = 5434, time = 0s
                      No path found on relation 11 -> 5. Non-assigned demand for DSeg PuT: 6.866
                      No path found on relation 11 -> 7. Non-assigned demand for DSeg PuT: 5.657
                      No path found on relation 11 -> 8. Non-assigned demand for DSeg PuT: 34.484
                      Search from zone 24: Search tree dimension = 4677, time = 0s
                      No path found on relation 24 -> 5. Non-assigned demand for DSeg PuT: 310.423
                      No path found on relation 24 -> 7. Non-assigned demand for DSeg PuT: 102.096
                      No path found on relation 24 -> 8. Non-assigned demand for DSeg PuT: 338.73
                      No path found on relation 11 -> 18. Non-assigned demand for DSeg PuT: 7.044
                      No path found on relation 11 -> 21. Non-assigned demand for DSeg PuT: 78.007
                      No path found on relation 24 -> 18. Non-assigned demand for DSeg PuT: 125.997
                      No path found on relation 24 -> 20. Non-assigned demand for DSeg PuT: 18.35
                      No path found on relation 24 -> 21. Non-assigned demand for DSeg PuT: 306.569
                      Search from zone 23: Search tree dimension = 7104, time = 0s
                      No path found on relation 23 -> 5. Non-assigned demand for DSeg PuT: 454.675
                      No path found on relation 23 -> 7. Non-assigned demand for DSeg PuT: 100.436
                      No path found on relation 23 -> 8. Non-assigned demand for DSeg PuT: 297.975
                      Search from zone 10: Search tree dimension = 5997, time = 0s
                      No path found on relation 10 -> 5. Non-assigned demand for DSeg PuT: 30.212
                      Search from zone 12: Search tree dimension = 5216, time = 0s
                      No path found on relation 10 -> 7. Non-assigned demand for DSeg PuT: 15.025
                      No path found on relation 10 -> 8. Non-assigned demand for DSeg PuT: 27.832
                      No path found on relation 23 -> 18. Non-assigned demand for DSeg PuT: 249.847
                      No path found on relation 23 -> 20. Non-assigned demand for DSeg PuT: 36.724
                      No path found on relation 23 -> 21. Non-assigned demand for DSeg PuT: 424.997
                      No path found on relation 12 -> 5. Non-assigned demand for DSeg PuT: 22.248
                      No path found on relation 10 -> 18. Non-assigned demand for DSeg PuT: 20.274
                      No path found on relation 12 -> 7. Non-assigned demand for DSeg PuT: 2.915
                      The maximum number (200) of messages for OD pairs has been output. Further messages will not be issued.
                      Search from zone 13: Search tree dimension = 5994, time = 0s
                      Search from zone 14: Search tree dimension = 5531, time = 0s
                      Number of calculated search runs 24
                      Time search = 0s
                      Time choice = 0s
                      Time save = 0s
                      Time skims = 0s
                      Time summary = 0s
                      The assignment succeeded. 28 origin zones had been assigned.
03/29/18 23.14.04.558 Start Procedure step  21: "Group"
03/29/18 23.14.04.700 Start Procedure step  22: "Assignment analysis"
03/29/18 23.14.04.920 Procedure - end
03/29/18 23.14.05.224 Start time of Save version C:\Users\rafal\Documents\GitHub\Model_Ogolny_Miejskiej_Mobilnosci\MOMM\Scenarios\S000006\S000006result
                            19 User-defined attributes
                             8 Transport systems
                             5 Modes
                             5 Demand segments
                             1 Calendar periods
                             1 Valid days
                             2 Directions
                           749 Points
                           749 Edges
                            28 Faces
                            28 Surfaces
                           487 Nodes
                            28 Zones
                             1 Territories
                           100 Link types
                          1448 Links
                          4496 Turns
                           184 Connectors
                            16 Stops
                            16 Stop areas
                            15 Stop points
                            16 Transfer walk times between stop areas
                             1 Lines
                             2 Line routes
                             2 Time profiles
                           170 Vehicle journeys
                            16 Specific transition times
                             1 Block versions
                             1 Signal coordination groups
                             3 Signalized junctions
                             1 Demand models
                             9 Demand strata
                            37 Matrices
                             1 Time series
                             1 Demand time series
                             1 Path sets
                             8 PrT assignment quality data
                             1 Turning standards
03/29/18 23.14.05.772 End time of Save version C:\Users\rafal\Documents\GitHub\Model_Ogolny_Miejskiej_Mobilnosci\MOMM\Scenarios\S000006\S000006result
03/29/18 23.14.06.867 Processing computation order 502cd476-48c4-4442-aa6d-90c0387f0771 completed
03/29/18 23.14.06.910 No further calculation order to process
03/29/18 23.14.07.618 Close file
